"Blockchain-Based Authentication Schemes in Smart Environments: A Systematic Literature Review","M. A. Al Sibahee; Z. A. Abduljabbar; A. Ngueilbaye; C. Luo; J. Li; Y. Huang; J. Zhang; N. Khan; V. O. Nyangaresi; A. H. Ali","National Engineering Laboratory for Big Data System Computing Technology, Shenzhen University, Shenzhen, China; Department of Computer Science, College of Education for Pure Sciences, University of Basrah, Basrah, Iraq; National Engineering Laboratory for Big Data System Computing Technology and the Big Data Institute, College of Computer Science and Software Engineering, Shenzhen University, Shenzhen, China; National Engineering Laboratory for Big Data System Computing Technology, Shenzhen University, Shenzhen, China; National Engineering Laboratory for Big Data System Computing Technology, Shenzhen University, Shenzhen, China; National Engineering Laboratory for Big Data System Computing Technology, Shenzhen University, Shenzhen, China; National Engineering Laboratory for Big Data System Computing Technology, Shenzhen University, Shenzhen, China; College of Big Data and Internet, Shenzhen Technology University, Shenzhen, China; Department of Computer Science and Software Engineering, Jaramogi Oginga Odinga University of Science and Technology, Bondo, Kenya; Department of Mathematics, College of Education for Pure Sciences, University of Basrah, Basrah, Iraq",IEEE Internet of Things Journal,"25 Oct 2024","2024","11","21","34774","34796","This study presents a systematic literature review on blockchain-based authentication in smart environments that include smart city, smart home, smart grid, smart healthcare, smart farming and smart transportation. The review incorporated 39 articles presenting blockchain solutions for security and privacy issues through authentication mechanisms in these smart environments. Guided by three research questions to determine the main issues in smart environment, the availability of blockchain-based authentication solutions and identified research gaps and future research endeavors, this review used PRISMA method to provide insights on the use of blockchain-based authentication schemes. The research gap is that blockchain solutions are mostly at the proposal, and sometimes conceptual stage is in the reviewed articles. In addition, solutions presented in smart environments require exploration into blockchain. The findings show similar situational issues across different smart environments and the flexibility and adaptability of blockchain to provide solutions to the identified issues pertaining to security and privacy. More clearly, the authentication problem posed across different smart environments can be adapted to blockchain technology provided that it is combined with other technologies to increase efficiency, despite the existence of large-scale authentication mechanisms. Now, blockchain still has the unique, distributed feature of converting the current database into blockchain databases. This review guided future research directions which could further contribute to the sustainable management of smart environments.","2327-4662","","10.1109/JIOT.2024.3422678","National Key Research and Development Program of China(grant numbers:2023YFB4704900); Deep Research Fund(grant numbers:000138010183/2024); National Natural Science Funds for Distinguished Young Scholar(grant numbers:62325307); National Natural Science Foundation of China(grant numbers:62073225,62203134,62072315); Natural Science Foundation of Guangdong Province(grant numbers:2023B1515120038); Science, Technology and Innovation Commission of Shenzhen Municipality(grant numbers:20220809141216003,JCYJ20210324093808021,JCYJ20220531102817040); Guangdong “Pearl River Talent Recruitment Program”(grant numbers:2019ZT08X603); Guangdong “Pearl River Talent Plan”(grant numbers:2019JC01X235); Scientific Instrument Developing Project of Shenzhen University(grant numbers:2023YQ019); ","https://ieeexplore.ieee.org/stamp/stamp.jsp?arnumber=10584093","Authentication;blockchain;Internet of Things (IoT);smart environment","Smart cities;Blockchains;Authentication;Security;Smart homes;Smart grids;Renewable energy sources","","18","","119","IEEE","3 Jul 2024","","","IEEE","IEEE Journals"
"Smart Agriculture: Software Platform for Telematics Monitoring in Farm Machinery","D. J. Yeong; K. Panduru; J. Walsh","STEM, IMaR Research Centre, Munster Technological University (MTU), Co. Kerry, Tralee, Ireland; STEM, IMaR Research Centre, Munster Technological University (MTU), Co. Kerry, Tralee, Ireland; STEM, IMaR Research Centre, Munster Technological University (MTU), Co. Kerry, Tralee, Ireland",2024 35th Irish Signals and Systems Conference (ISSC),"29 Jul 2024","2024","","","1","6","Agriculture 4.0, also known as Smart Farming or AgriTech 4.0, signifies a paradigm shift in agribusinesses. It represents the fourth agricultural revolution that uses state-of-the-art and innovative technologies, such as Internet of Things (IoT) and data analysis, to cultivate a sustainable, resilient, and more efficient agricultural practices that can address the ever-growing challenges of the 21st century. This paper proposes the development and implementation of a software system designed to gather, store, and monitor telematics data in farm machinery. By reviewing various software components (front-end and back-end), we aim to provide insights into the key components of the software system and outline a scalable software architecture for monitoring machine telematics in smart farm machinery. Using the proposed software system (web application), users can view historical machine telematics data and monitor the operational performances to optimize farming practices. Furthermore, our system allows real-time alerts to ensure timely intervention and offers potential for integrating predictive analytics to anticipate maintenance needs and improve operational efficiencies.","2688-1454","979-8-3503-5298-6","10.1109/ISSC61953.2024.10602840","","https://ieeexplore.ieee.org/stamp/stamp.jsp?arnumber=10602840","agriculture;smart farming;telematics monitoring;software platform;front-end;back-end;progressive web app","Smart agriculture;Software architecture;Telematics;Software systems;Real-time systems;Maintenance;Internet of Things","","1","","44","IEEE","29 Jul 2024","","","IEEE","IEEE Conferences"
"Model based software component verification","L. Tang; X. Zhou; Z. Wang; Y. Fei; J. Zhang","College of computer & information engineering, Hohai University, HHU, Nanjing, China; College of computer & information engineering, Hohai University, HHU, Nanjing, China; College of computer & information engineering, Hohai University, HHU, Nanjing, China; College of information science & engineering, Shandong Agricultural University, Taian, China; College of information science & engineering, Shandong Agricultural University, Taian, China",The 2nd International Conference on Software Engineering and Data Mining,"9 Aug 2010","2010","","","11","16","Developing software components requires a high focus on software quality. A novel approach was proposed from the component producer perspective to improve it in this paper. First, atomic service, service extension and extension rule were defined respectively. Secondly, an effective component model was defined, in terms of service, to describe all services which a component can provide. Thirdly, the process of constructing a component service by atomic service extension was given and illustrated in an application sample. The concrete sample shows that this component model can provide an effective verification approach which can automatically determine whether a component service satisfies a certain user's requirement or not. And it can also help improve the usability of a software component and the efficiency of component based software development.","","978-89-88678-22-0","","","https://ieeexplore.ieee.org/stamp/stamp.jsp?arnumber=5542959","Software component;verificaton;component model;atomic sendee;service extension;extension constraint","Usability;Testing;Software quality;Software systems;Educational institutions;Agricultural engineering;Computer industry;Application software;Programming;Software maintenance","","1","","15","","9 Aug 2010","","","IEEE","IEEE Conferences"
"IoT Based Plantation System for Smart Home Farming","V. Rai; S. Patidar","Department of Software Engineering, Delhi Technological University, Delhi; Department of Software Engineering, Delhi Technological University, Delhi","2023 International Conference on Electrical, Electronics, Communication and Computers (ELEXCOM)","1 Jan 2024","2023","","","1","5","Home smart farming is the area where Internet of things (IoT) applications are expanding. The effectiveness and quality of agricultural goods have been recommended to be increased by using various monitoring, controlling, and tracking systems. Many people would like to start their own small-scale farms at home to produce organic goods for their daily consumption, even if the majority of the existing systems concentrate on industrial farming. However, due to a lack of agricultural infrastructure and understanding, people are frequently unable to produce healthy agricultural goods and are also unable to safeguard their indoor plants from too much and too little sunshine. The IoT-based plantation system described in this research attempts to maximize plant growth while shielding plants from excessive or insufficient sunlight. The system uses sensors to assess important environmental variables such as light intensity, and temperature, integrating IoT technology with agriculture. The gathered data is processed, examined, and sent to a cloud server for archival and examination. Real-time data visualization, notifications, and user interaction are made possible through a user-friendly mobile application. The main focus is on protecting plants by keeping an eye on light levels to prevent harmful consequences of excessive or insufficient sunshine exposure. The system uses the IoT infrastructure to assure ideal circumstances for plant growth as well as remote monitoring and control, which results in effective resource management.","","979-8-3503-0511-1","10.1109/ELEXCOM58812.2023.10370530","","https://ieeexplore.ieee.org/stamp/stamp.jsp?arnumber=10370530","Internet of Things (IoT);Plantation System;Smart Home Farming;Light Intensity Monitoring;Plant Growth Optimization;Sunlight Protection","Temperature sensors;Temperature measurement;Smart agriculture;Smart homes;Sensor systems;Sensors;Internet of Things","","1","","15","IEEE","1 Jan 2024","","","IEEE","IEEE Conferences"
"Enabling Automated Integration Testing of Smart Farming Applications via Digital Twin Prototypes","A. Barbie; W. Hasselbring; M. Hansen","Software Engineering Group, Christian-Albrechts-University, Kiel, Germany; Software Engineering Group, Christian-Albrechts-University, Kiel, Germany; Software Engineering Group, Christian-Albrechts-University, Kiel, Germany",2023 IEEE Smart World Congress (SWC),"1 Mar 2024","2023","","","1","8","Industry 4.0 represents a major technological shift that has the potential to transform the manufacturing industry, making it more efficient, productive, and sustainable. Smart farming is a concept that involves the use of advanced technologies to improve the efficiency and sustainability of agricultural practices. Industry 4.0 and smart farming are closely related, as many of the technologies used in smart farming are also used in Industry 4.0. Digital twins have the potential for cost-effective software development of such applications.With our Digital Twin Prototype approach, all sensor interfaces are integrated into the development process, and their inputs and outputs of the emulated hardware match those of the real hardware. The emulators respond to the same commands and return identically formatted data packages as their real counterparts, making the Digital Twin Prototype a valid source of a digital shadow, i.e. the Digital Twin Prototype is a prototype of the physical twin and can replace it for automated testing of the digital twin software. In this paper, we present a case study for employing our Digital Twin Prototype approach to automated testing of software for improving the making of silage with a smart farming application.Besides automated testing with continuous integration, we also discuss continuous deployment of modular Docker containers in this context.","","979-8-3503-1980-4","10.1109/SWC57546.2023.10449240","","https://ieeexplore.ieee.org/stamp/stamp.jsp?arnumber=10449240","Smart Farming;Agricultural Machinery;Digital Twin Prototypes;Automated Testing;Continuous Integration","Smart agriculture;Prototypes;Software;Hardware;Digital twins;Fourth Industrial Revolution;Testing","","2","","19","IEEE","1 Mar 2024","","","IEEE","IEEE Conferences"
"Open Lora Design and Implementation For IoT","D. K. Yadav; T. A. V. M; M. Aadil","Maharishi School of Engineering & Technology, Maharishi University of Information Technology, Uttar Pradesh, India; Department of Electronics and Communication Engineering, Presidency University, Bangalore, Karnataka, India; Department of Computer Science and Information Technology, Jain (Deemed to be University), Bangalore, India","2023 International Conference on Power Energy, Environment & Intelligent Control (PEEIC)","13 Mar 2024","2023","","","822","826","As an effective low-power wide-area (LPWA) connection that enables energy-efficient gadgets to build an affordable connection across huge regions, the Long Range (LoRa) networking is gaining appeal. This article provides users with a strong basis for numerous IoT applications by outlining a practical method for building and implementing a private LoRa network. Typical LoRa network-based scenarios are examined before we show the LoRa system's structure and describe the functions of every component. In addition, we provide a thorough examination of the equipment conception and development of the LoRa The Gateway, which serves as a link amongst LoRa terminals to the LoRa net administration. Notably, we provide an improved software design for the LoRa servers as well as make its free to download software source code accessible on GitHub as a noteworthy contribution. This design provides flexibility and adaptability by segmenting the LoRa networking server into five separate modules and implementing a message system based on information streaming for inter-module interaction. The performance of the LoRa network is thoroughly tested in the paper's conclusion in real-world settings.","","979-8-3503-5776-9","10.1109/PEEIC59336.2023.10451093","","https://ieeexplore.ieee.org/stamp/stamp.jsp?arnumber=10451093","LoRa network;IoT applications;LPWA connection;LoRa Node;LoRa Gateway;LoRa Network Server;Equipment conception;Software design;Microservices and IoT possibilities","Industries;Software design;Source coding;Urban areas;LoRa;Logic gates;Software;Internet of Things;Servers;Software development management","","2","","26","IEEE","13 Mar 2024","","","IEEE","IEEE Conferences"
"Pathways for Security of Embedded System: Issues and Challenges","S. K. Diwaker; P. K. Chaurasia; M. Khaliq","Dept. of Computer Science and Information Technology, Khwaja Moinuddin Chishti Language, Lucknow, India; Dept. of Information Technology, Babasaheb Bhimrao Ambedkar Central University, Lucknow, India; Dept. of Computer Science and Information Technology, Khwaja Moinuddin Chishti Language, Lucknow, India",2024 Second International Conference Computational and Characterization Techniques in Engineering & Sciences (IC3TES),"17 Feb 2025","2024","","","1","5","In today's scenario, security threats are increasing day by day as technology. Security breaches not only affect financial loss but also affect the trustworthiness and integrity of the software design and embedded software development industry. These breaches directly affect the security attributes. The objective of security in an embedded system is to protect the device from vulnerable attributes. The aim of this paper, identify challenges in embedded systems applied in various applications, research gaps, and untouched areas to discover possible parameters for sustainable devices.","","979-8-3503-6469-9","10.1109/IC3TES62412.2024.10877516","","https://ieeexplore.ieee.org/stamp/stamp.jsp?arnumber=10877516","Healthcare;Device Manager;Internet of Medical Things;Cyber security;Authenticity;Authorization;Access Control","Embedded systems;Software design;Protocols;Medical services;Quality of service;Computer architecture;Software reliability;Security;Internet of Things;Resource management","","","","36","IEEE","17 Feb 2025","","","IEEE","IEEE Conferences"
"Development of Prototype Smart Control Systems to Support IoT and LoRA-Based Smart Farming in Smart Agriculture Applications","R. Hartono; R. E. Fata; R. F. Ulwan; R. J. Nur Iman; N. R. Perdana; R. C. Wulan","Department of Informatic Engineering Vocational School, Universitas Sebelas Maret, Surakarta, Indonesia; Department of Informatic Engineering Vocational School, Universitas Sebelas Maret, Surakarta, Indonesia; Department of Informatic Engineering Vocational School, Universitas Sebelas Maret, Surakarta, Indonesia; Department of Informatic Engineering Vocational School, Universitas Sebelas Maret, Surakarta, Indonesia; Department of Informatic Engineering Vocational School, Universitas Sebelas Maret, Surakarta, Indonesia; Department of Informatic Engineering Vocational School, Universitas Sebelas Maret, Surakarta, Indonesia","2022 1st International Conference on Smart Technology, Applied Informatics, and Engineering (APICS)","25 Oct 2022","2022","","","186","190","Indonesia is an agrarian country; it can be seen from the extent of agricultural land in Indonesia, which has enormous potential. However, managing such an area of land is not optimal if farmers only work on it. The quality of agricultural products depends on the experience and instincts of farmers in understanding the land conditions and crops. Of course, these results are less when compared with the calculated calculations. We are here to help farmers manage their agricultural land from these problems. Iotanic offers products in the form of IoT devices that can monitor and automate agricultural land. With the precision farming method, the monitoring data will be precise, and the execution of agricultural management will become more precise and automated thanks to the resulting data. The manufacture of the product starts by analyzing the device's needs to be produced. These needs are in the form of hardware development needs in the form of IoT devices and software development in the form of applications. This analysis develops the device into a prototype product ready to be tested. These activities will produce IoT products and software to help farmers manage their agricultural land. To be able to produce these devices, production costs and the value of products/services are required funds amounting to 24,998,200.00","","978-1-6654-8985-0","10.1109/APICS56469.2022.9918778","","https://ieeexplore.ieee.org/stamp/stamp.jsp?arnumber=9918778","IoT;LoRA;Agricultural;Farmers","Smart agriculture;Prototypes;Crops;Production;Software;Hardware;Internet of Things","","2","","8","IEEE","25 Oct 2022","","","IEEE","IEEE Conferences"
"Co-design of an Agricultural Management Application for Small-Scale Farmers","V. Hashiyana; N. Suresh; T. Haiduwa; D. MBEWE; M. M. Ujakpa","University of Namibia, 340 Mandume Ndemufayo Ave, Pionierspark, Windhoek, Namibia; University of Namibia, 340 Mandume Ndemufayo Ave, Pionierspark, Windhoek, Namibia; University of Namibia, 340 Mandume Ndemufayo Ave, Pionierspark, Windhoek, Namibia; University of Namibia, 340 Mandume Ndemufayo Ave, Pionierspark, Windhoek, Namibia; International University of Management, 21 - 31, Hercules Street, Windhoek, Namibia",2020 IST-Africa Conference (IST-Africa),"20 Jul 2020","2020","","","1","7","Most African farm homesteads are seeing a steady sub-division of their land that sheds light on small-scale farming. Small-scale farmers are poised to be significant economic drivers in developing countries in Africa. Hence, indicative of the potential in smart farming applications. This research aimed at providing appropriate farming practices information through co-designing an Agricultural Management Application that would maximize small-scale farmer's crop production. Reviewing relevant literature and applying an experimental design approach, the Agricultural Management Application was developed in this research. The results of the study were satisfactory as the application developed was deemed useful and informative by local farmers. Since only a few crops were listed on the application currently in use, it is further recommended that more crops be added to this mobile application. This will allow farmers to expand their scope of participation and the use of the application.","2576-8581","978-1-905824-65-6","","","https://ieeexplore.ieee.org/stamp/stamp.jsp?arnumber=9144024","Co-design;Small-scale farmers;Android-based application;Crops;Agricultural information and Agricultural management application","Agriculture;Mobile applications;Testing;Software;Smart phones;Production;Electronic mail","","","","12","","20 Jul 2020","","","IEEE","IEEE Conferences"
"IoT System Design for Agro-Tourism","T. Ganokratanaa; P. Pramkeaw; M. Ketcham; N. Chumuang; W. Yimyam; P. Timted","Applied Computer Science Program King Mongkut’s University of Technology Thonburi, Bangkok, Thailand; Media Technology Program King Mongkut’s University of Technology Thonburi, Bangkok, Thailand; Dept. of Information Technology Management, King Mongkut's University of Technology North Bangkok, Bangkok, Thailand; Dept. of Digital Media Technology, Muban Chombueng Rajabhat University, Ratchaburi, Thailand; Dept. of Business Information Management, Phetchaburi Rajabhat University, Phetchaburi, Thailand; Dept. of Information Technology Management, King Mongkut's University of Technology North Bangkok, Bangkok, Thailand",2021 18th International Joint Conference on Computer Science and Software Engineering (JCSSE),"27 Jul 2021","2021","","","1","6","Agro-Tourism is another form of tourism in which the visitors can gain both enjoyment and knowledge. It covers various types of agriculture, including garden, herb, livestock, aquaculture facility, and pet farm. In modern technology, Agro-Tourism can be improved as a smart farm with the intelligent system design using the Internet of Things (IoT) to help care for crops. It also can be applied with educational institutions for research and agricultural production and development. Our proposed IoTs system helps to increase the convenience of farmers as the experimental results show that we achieve good performance with a 98% accuracy rate.","2642-6579","978-1-6654-3831-5","10.1109/JCSSE53117.2021.9493826","","https://ieeexplore.ieee.org/stamp/stamp.jsp?arnumber=9493826","intelligent;IoT;Agro-Tourism;prototype;design","Temperature sensors;Temperature measurement;Soil;Water pumps;Sensor systems;Sensors;Temperature control","","30","","16","IEEE","27 Jul 2021","","","IEEE","IEEE Conferences"
"Evaluating LoRaWAN performance in intentional and unintentional DoS attacks by legacy 900MHz network devices","S. Bang; J. Jang; M. Ro; Y. Choi; D. Kwon; K. Lee; A. Smith","School of Computer Science and Engineering, Chung-Ang University, Seoul, Korea; School of Computer Science and Engineering, Chung-Ang University, Seoul, Korea; School of Computer Science and Engineering, Chung-Ang University, Seoul, Korea; Department of Software Engineering, Chonnam National University, Gwangju, Korea; School of Computer Science and Engineering, Kyungpook National University, Daegu, Korea; Department of Computer and Information Technology, Purdue University, Indiana, United States; Department of Computer and Information Technology, Purdue University, Indiana, United States",2023 6th International Conference on Advanced Communication Technologies and Networking (CommNet),"22 Dec 2023","2023","","","1","7","The deployment of LoRaWAN on the Internet of Things (IoT) has increased since its advent and LoRaWAN now predominates the IoT market over other Low Powered Wide Area Networks (LPWAN). However, since LoRaWAN uses Chirp Spread Spectrum (CSS), it is susceptible to wideband jamming attacks. In this paper, we demonstrate with experiments and concrete numerical results that jamming US915 LoRaWAN frequency is possible by the usual data transmission and reception process of 900MHz Canopy, one of the legacy 900MHz network device. Intentional attack is possible in the same manner. The experiments emulate the real-world environment operated in medical and agriculture industries, in outdoor and indoor conditions, respectively. In addition, this paper introduces and utilizes the novel metric, Jamming Effect (JE), that indicates the network performance of wireless networks that spread the data on air.","2771-7402","979-8-3503-2939-1","10.1109/CommNet60167.2023.10365253","","https://ieeexplore.ieee.org/stamp/stamp.jsp?arnumber=10365253","Internet of Things;LoRa;LoRaWAN;security;risk assessment;vulnerability;radio frequency;Chirp Spread Spectrum (CSS);canopy;jamming;Denial of Service","Performance evaluation;Wireless networks;RF signals;Physical layer;Security;Internet of Things;Data communication","","","","26","IEEE","22 Dec 2023","","","IEEE","IEEE Conferences"
